{
  "schema_version": 1,
  "contract_id": "tracedecay.observation-policy.v1",
  "bead_id": "tdmem-0501",
  "title": "Post-commit coding-agent host event observation policy",
  "status": "accepted",
  "scope": "coding_agents_only",
  "authority": "TraceDecay host and application settlement authority",
  "policy_boundary": {
    "admission_boundary": "after_canonical_source_settlement",
    "default_disposition": "exclude",
    "unknown_event_disposition": "exclude",
    "completed_or_committed_coding_outcomes_only": true,
    "provider_fanout_after_settlement": true,
    "rolled_back_never_admitted": true,
    "uncommitted_secrets_never_admitted": true,
    "transient_and_noise_default_excluded": true,
    "provider_failure_cannot_change_source_outcome": true,
    "observation_contract": "product/contracts/memory-provider-v1/provider-observation-contract.json"
  },
  "dimensions": {
    "durability": {
      "values": [
        "committed_durable",
        "session_durable",
        "settled_durable",
        "ephemeral",
        "uncommitted",
        "rolled_back",
        "unknown"
      ],
      "admitted_values": [
        "committed_durable",
        "session_durable",
        "settled_durable"
      ],
      "excluded_values": [
        "ephemeral",
        "uncommitted",
        "rolled_back",
        "unknown"
      ]
    },
    "sensitivity": {
      "values": [
        "public",
        "internal",
        "sensitive",
        "sensitive_possible",
        "secret",
        "personal_data",
        "unknown"
      ],
      "secret_value": "secret",
      "admission_rule": "Secret and unadmitted personal data never cross the provider boundary; admitted payloads carry a privacy classification and redaction result."
    },
    "relevance": {
      "values": ["high", "medium", "low", "noise"],
      "noise_value": "noise",
      "admission_rule": "Admit only bounded coding outcomes whose relevance is evidenced by the settled event; classify transient operational output as noise."
    }
  },
  "coding_scope_derivation": {
    "policy_id": "coding_scope_v1",
    "mode": "required_authoritative_receipt",
    "authority": "TraceDecay registered-scope and host-session admission",
    "receipt_name": "ScopeAdmissionReceiptV1",
    "required_fields": [
      "profile_id",
      "project_id",
      "repository_id",
      "worktree_id",
      "branch_ref",
      "agent_session_id",
      "resolved_scope_digest"
    ],
    "identity_fields": [
      "profile_id",
      "project_id",
      "repository_id",
      "worktree_id",
      "branch_ref",
      "agent_session_id",
      "resolved_scope_digest"
    ],
    "optional_fields": ["branch_ref"],
    "evidence_only_fields": [
      "source_path",
      "working_directory",
      "repository_display_name"
    ],
    "forbidden_inference_inputs": [
      "cwd",
      "path_string",
      "repository_name",
      "nearest_project",
      "process_id",
      "timestamp_only"
    ],
    "algorithm": "Copy the exact identity fields from the already validated ScopeAdmissionReceiptV1 attached to the host or application event; verify its resolved-scope digest and session binding, and never parse a path, CWD, repository name, process ID, or nearest project to invent scope.",
    "failure": "exclude_scope_unresolved"
  },
  "source_provenance_derivation": {
    "policy_id": "source_provenance_v1",
    "mode": "required_authoritative_receipt",
    "authority": "TraceDecay canonical source settlement authority",
    "receipt_name": "CanonicalSettlementReceiptV1",
    "required_fields": [
      "source_authority",
      "source_event_id",
      "source_event_revision",
      "source_event_sha256",
      "canonical_settlement_receipt"
    ],
    "identity_fields": [
      "source_authority",
      "source_event_id",
      "source_event_revision",
      "source_event_sha256"
    ],
    "optional_fields": ["evidence_anchors", "transform_chain"],
    "evidence_only_fields": [
      "source_path",
      "byte_range",
      "line_range",
      "working_directory"
    ],
    "forbidden_inference_inputs": [
      "path_string",
      "cwd",
      "display_label",
      "timestamp_only",
      "unsettled_result",
      "heuristic_event_name"
    ],
    "algorithm": "Copy source authority, event identity, revision, digest, and the canonical settlement receipt from the owning host or application authority; verify that the receipt binds the settled digest and commit point, and treat paths and ranges as evidence anchors only, never as source identity.",
    "failure": "exclude_source_unsettled_or_provenance_unavailable"
  },
  "admission_requirements": [
    "The event is a completed or committed coding outcome, not an intent or preview.",
    "The canonical source authority has emitted a settlement receipt before provider fan-out.",
    "The exact scope receipt supplies profile, project, repository, worktree, branch, session, and resolved-scope-digest identity.",
    "The source provenance receipt supplies authority, event ID, revision, digest, and settlement proof.",
    "The event is classified for durability, sensitivity, and coding relevance.",
    "Secret-like and unadmitted personal content is rejected or redacted before admission.",
    "Provider delivery is advisory and cannot alter the settled source outcome."
  ],
  "default_exclusion_reasons": [
    {
      "code": "speculative_intent",
      "description": "A request, plan, preview, or proposed action has not produced a settled coding outcome.",
      "boundary": "before_canonical_source_settlement",
      "retry_policy": "do_not_retry_as_observation"
    },
    {
      "code": "rolled_back",
      "description": "The source authority reports that the attempted mutation was reverted or did not remain committed.",
      "boundary": "source_settlement_rejected",
      "retry_policy": "never_replay_rolled_back_content"
    },
    {
      "code": "uncommitted",
      "description": "Content exists only in an editor, overlay, temporary buffer, or pending transaction.",
      "boundary": "before_durable_commit",
      "retry_policy": "wait_for_a_new_settled_event"
    },
    {
      "code": "secret",
      "description": "The payload contains raw credentials, secret material, or a secret-like value that is not redacted.",
      "boundary": "privacy_filter_before_observation",
      "retry_policy": "do_not_retry_raw_payload"
    },
    {
      "code": "transient",
      "description": "The event is an in-flight lifecycle signal, heartbeat, cancellation, or temporary snapshot.",
      "boundary": "before_stable_outcome",
      "retry_policy": "do_not_replay_transient_signal"
    },
    {
      "code": "noise",
      "description": "The event is operational or read-only noise with no bounded coding outcome to teach.",
      "boundary": "outside_coding_outcome_set",
      "retry_policy": "do_not_retry_noise"
    },
    {
      "code": "incomplete_outcome",
      "description": "The operation ended without a definitive committed or completed result.",
      "boundary": "settlement_receipt_missing_terminal_state",
      "retry_policy": "admit_only_a_later_definitive_settlement"
    },
    {
      "code": "scope_unresolved",
      "description": "The authoritative exact coding scope is absent, stale, or inconsistent.",
      "boundary": "before_scope_binding",
      "retry_policy": "re-admit_only_with_a_valid_scope_receipt"
    },
    {
      "code": "provenance_unavailable",
      "description": "The owning authority cannot provide a stable source identity and canonical settlement proof.",
      "boundary": "before_source_identity",
      "retry_policy": "do_not_guess_source_identity"
    },
    {
      "code": "provider_operational",
      "description": "The signal describes provider delivery or infrastructure state rather than a host coding outcome.",
      "boundary": "outside_host_source_event",
      "retry_policy": "retain_only_in_provider_operations_telemetry"
    }
  ],
  "host_families": [
    {
      "host_id": "claude",
      "source_authority": "host_session",
      "event_surface": "hook and transcript records",
      "scope_receipt": "ScopeAdmissionReceiptV1",
      "source_paths": [
        "crates/tracedecay-sessions/src/runtime/hosts/claude_observation.rs",
        "crates/tracedecay-capture/src/claude/mod.rs"
      ],
      "observation_mapping": "host.session_message_committed.v1",
      "notes": "A provider observation follows the durable session observation commit, not an incoming hook intent."
    },
    {
      "host_id": "codex",
      "source_authority": "host_session",
      "event_surface": "rollout JSONL frames and app-server records",
      "scope_receipt": "ScopeAdmissionReceiptV1",
      "source_paths": [
        "crates/tracedecay-sessions/src/runtime/hosts/codex/observation.rs",
        "crates/tracedecay-capture/src/codex.rs"
      ],
      "observation_mapping": "host.session_message_committed.v1",
      "notes": "The resolved project or profile admission owns the rollout; a path is never used as source identity."
    },
    {
      "host_id": "cursor",
      "source_authority": "host_session",
      "event_surface": "Cursor transcript snapshot records",
      "scope_receipt": "ScopeAdmissionReceiptV1",
      "source_paths": [
        "crates/tracedecay-sessions/src/runtime/hosts/cursor.rs",
        "crates/tracedecay-capture/src/cursor.rs"
      ],
      "observation_mapping": "host.session_message_committed.v1",
      "notes": "Only a complete normalized snapshot admitted by the host authority can leave the session boundary."
    },
    {
      "host_id": "cursor_composer",
      "source_authority": "host_session",
      "event_surface": "Cursor Composer SQLite records",
      "scope_receipt": "ScopeAdmissionReceiptV1",
      "source_paths": [
        "crates/tracedecay-sessions/src/runtime/hosts/cursor_composer/capture.rs",
        "crates/tracedecay-capture/src/cursor_composer.rs"
      ],